{
  "schema_version": 1,
  "fixture_set_id": "hapax-unified-self-grounding-ontology-v1",
  "schema_ref": "schemas/self-presence-envelope.schema.json",
  "generated_from": [
    "Documents/Personal/20-projects/hapax-research/audits/2026-04-30-hapax-unified-self-grounding-discovery-synthesis.md",
    "Documents/Personal/20-projects/hapax-research/specs/2026-04-30-hapax-unified-self-grounding-spine.md",
    "Documents/Personal/20-projects/hapax-research/specs/2026-04-29-world-capability-surface-parent-spec.md",
    "Documents/Personal/20-projects/hapax-research/specs/2026-04-29-first-principles-semantic-recruitment-formalization.md"
  ],
  "roles_are_offices_statement": "Roles are offices/lenses that define answerability and authority; they are not masks, personas, activities, or fictional selves.",
  "prompt_only_non_witness_states": [
    "selection",
    "command_dispatch",
    "prompt_text",
    "render_state",
    "inference",
    "log_write"
  ],
  "ontology_term_mappings": [
    {
      "term": "Aperture",
      "definition": "A boundary of perspective and exposure through which a claim, answer, action, or representation is situated.",
      "maps_to": {
        "wcs": ["WorldCapabilityRecord.surface_refs", "SemanticSubstrate.public_claim_policy"],
        "temporal": ["TemporalEvidenceEnvelope.public_scope", "TemporalEvidenceEnvelope.span_refs"],
        "chronicle": ["chronicle_refs", "speech_event_refs"],
        "role": ["RoleState.addressee_mode", "RoleState.route_posture"],
        "impingement": ["Impingement.intent_family", "recruitment_context_refs"]
      }
    },
    {
      "term": "RoleState",
      "definition": "The active office or lens that determines answerability, route posture, authority, and addressee.",
      "maps_to": {
        "wcs": ["WorldCapabilityRecord.authority_ceiling", "WorldCapabilityRecord.public_private_posture"],
        "temporal": ["TemporalEvidenceEnvelope.authority_ceiling", "TemporalEvidenceEnvelope.public_scope"],
        "chronicle": ["chronicle.role_ref", "speech_event.role_ref"],
        "role": ["RoleOffice", "AddresseeMode"],
        "impingement": ["Impingement.source", "Impingement.intent_family"]
      }
    },
    {
      "term": "SelfPresenceEnvelope",
      "definition": "Canonical per-turn or per-event projection over role, apertures, evidence, route, claim ceilings, and open obligations.",
      "maps_to": {
        "wcs": ["wcs_snapshot_refs", "public_claim_ceiling"],
        "temporal": ["temporal_evidence_refs", "active_environment_refs"],
        "chronicle": ["chronicle_refs", "triad_refs"],
        "role": ["role_state", "source_context_refs"],
        "impingement": ["recruitment_context_refs", "action_receipt_refs"]
      }
    },
    {
      "term": "ClaimBinding",
      "definition": "A link between a representation or assertion and evidence refs, authority ceiling, public/private mode, temporal band, and witnesses.",
      "maps_to": {
        "wcs": ["public_claim_policy", "witness_requirements"],
        "temporal": ["TemporalEvidenceEnvelope.temporal_band", "TemporalEvidenceEnvelope.authority_ceiling"],
        "chronicle": ["chronicle.claim_ref", "speech_event_id"],
        "role": ["RoleState.authority_scope", "RoleState.answerability_refs"],
        "impingement": ["tool_receipt", "outcome_learning_policy"]
      }
    },
    {
      "term": "ApertureEvent",
      "definition": "An append-only event keyed by aperture and temporal span; witnessed success is distinct from selection, command, render, log, and inference.",
      "maps_to": {
        "wcs": ["witness_refs", "outcome_learning_policy"],
        "temporal": ["temporal_span_ref", "span_refs"],
        "chronicle": ["speech_event_id", "public_event_ref"],
        "role": ["RoleState.route_posture", "RoleState.addressee_mode"],
        "impingement": ["Impingement.event_id", "action_receipt_refs"]
      }
    },
    {
      "term": "ContinuityObligation",
      "definition": "An open observation, question, utterance, action, promise, correction, or unresolved outcome that must resolve, expire, or stay visible.",
      "maps_to": {
        "wcs": ["blocked_reasons", "fallback"],
        "temporal": ["valid_until_wall", "must_verify_by"],
        "chronicle": ["triad_refs", "chronicle_refs"],
        "role": ["RoleState.answerability_refs", "RoleState.authority_scope"],
        "impingement": ["recruitment_context_refs", "outcome_learning_policy"]
      }
    }
  ],
  "envelopes": [
    {
      "schema_version": 1,
      "envelope_id": "self-presence:fixture.private-answer",
      "fixture_case": "private_answer",
      "role_state": {
        "role_id": "role:private-assistant",
        "office": "private_assistant",
        "addressee_mode": "operator",
        "answerability_refs": ["role-policy:single-operator", "aperture:private-assistant"],
        "authority_scope": ["private_only"],
        "route_posture": "private answer only",
        "roles_are_offices_not_masks": true
      },
      "apertures": [
        {
          "aperture_id": "aperture:private-assistant",
          "kind": "private_assistant",
          "exposure_mode": "private",
          "public_private_mode": "private",
          "evidence_classes": ["private-context", "operator-addressed"],
          "surface_refs": ["sidechat:operator-private"],
          "claim_authority_ceiling": "private_only"
        }
      ],
      "active_environment_refs": ["env:operator-workstation"],
      "source_context_refs": ["source:private-chat-turn"],
      "private_risk_flags": ["private-addressed"],
      "route_decision": "private",
      "programme_authorization": "not_required",
      "audio_safety": "not_applicable",
      "livestream_egress_state": "not_applicable",
      "wcs_snapshot_refs": ["wcs:private-assistant-context"],
      "temporal_evidence_refs": ["temporal-evidence:impression.private-turn"],
      "multimodal_evidence_refs": ["evidence:operator-addressed-text"],
      "speech_event_refs": [],
      "chronicle_refs": ["chronicle:private-turn"],
      "triad_refs": ["triad:operator-question"],
      "claim_bindings": [
        {
          "claim_id": "claim:private-answer-scope",
          "representation_ref": "answer:private",
          "evidence_envelope_refs": ["temporal-evidence:impression.private-turn"],
          "authority_ceiling": "private_only",
          "public_private_mode": "private",
          "temporal_band": "impression",
          "witness_refs": ["witness:operator-private-chat"],
          "support_states": ["private-context"]
        }
      ],
      "aperture_events": [
        {
          "event_id": "aperture-event:private-answer.observed",
          "aperture_id": "aperture:private-assistant",
          "event_kind": "private_utterance",
          "temporal_span_ref": "span:private-turn",
          "witness_refs": ["witness:operator-private-chat"],
          "success_state": "witnessed",
          "support_states": ["private-context"]
        }
      ],
      "continuity_obligations": [
        {
          "obligation_id": "continuity:private-answer-followup",
          "obligation_kind": "operator-question",
          "source_event_ref": "aperture-event:private-answer.observed",
          "status": "open",
          "visibility": "private",
          "resolution_policy": "resolve in private answer or carry visibly as private-only uncertainty"
        }
      ],
      "recruitment_context_refs": ["impingement:operator-private-question"],
      "action_receipt_refs": [],
      "consent_privacy_ceiling": "private_only",
      "rights_provenance_ceiling": "private_only",
      "public_claim_ceiling": "no_claim",
      "blockers": [],
      "allowed_outcomes": ["private_answer", "no_claim"]
    },
    {
      "schema_version": 1,
      "envelope_id": "self-presence:fixture.public-speech-candidate",
      "fixture_case": "public_speech_candidate",
      "role_state": {
        "role_id": "role:public-narrator-candidate",
        "office": "public_narrator",
        "addressee_mode": "public_audience",
        "answerability_refs": ["role-policy:public-claim-gate", "aperture:public-broadcast-voice"],
        "authority_scope": ["public_gate_required"],
        "route_posture": "candidate only until gates witness public route",
        "roles_are_offices_not_masks": true
      },
      "apertures": [
        {
          "aperture_id": "aperture:public-broadcast-voice",
          "kind": "public_broadcast_voice",
          "exposure_mode": "public_candidate",
          "public_private_mode": "public_candidate",
          "evidence_classes": ["programme-authorization", "audio-safe-state", "broadcast-route"],
          "surface_refs": ["route:semantic-broadcast"],
          "claim_authority_ceiling": "public_gate_required"
        }
      ],
      "active_environment_refs": ["env:livestream-programme"],
      "source_context_refs": ["source:public-intent-candidate"],
      "private_risk_flags": [],
      "route_decision": "held",
      "programme_authorization": "missing",
      "audio_safety": "safe",
      "livestream_egress_state": "not_witnessed",
      "wcs_snapshot_refs": ["wcs:broadcast-audio-safe"],
      "temporal_evidence_refs": ["temporal-evidence:impression.programme-window"],
      "multimodal_evidence_refs": ["evidence:route-intent-public"],
      "speech_event_refs": [],
      "chronicle_refs": ["chronicle:public-speech-candidate"],
      "triad_refs": [],
      "claim_bindings": [
        {
          "claim_id": "claim:public-speech-candidate",
          "representation_ref": "utterance:candidate",
          "evidence_envelope_refs": ["temporal-evidence:impression.programme-window"],
          "authority_ceiling": "public_gate_required",
          "public_private_mode": "public_candidate",
          "temporal_band": "impression",
          "witness_refs": ["witness:broadcast-audio-safe"],
          "support_states": ["gate-candidate"]
        }
      ],